Author,Quote,URL
Франсуа де Ларошфуко ,"Разлука убивает слабое чувство и разжигает сильную страсть, подобно тому, как ветер тушит свечи и раздувает костер.",http://forismatic.com/ru/d451ffba51/
Конфуций,"Не печалься о том, что никто не знает тебя, а стремись быть тем, кого могут знать. ",http://forismatic.com/ru/eef904bb32/
Альберт Эйнштейн,"Самое непостижимое в этом мире — то, что он постижим. ",http://forismatic.com/ru/c1f7a7ad95/
Софокл,"Кто в деле смел, тот слов не устрашится. ",http://forismatic.com/ru/c7082c578b/
Махатма Ганди,"Маленькое тело, обусловленное духом и воодушевленное неугасимой верой в свою миссию, может изменять ход истории. ",http://forismatic.com/ru/6631eb5c66/
